{"advisory":true,"apiVersion":"gitguard.domain/v1alpha1","authorization":"not-evaluated","candidate":{"advisory":true,"allowed_paths":[[46,103,105,116,105,103,110,111,114,101],[67,97,114,103,111,46,108,111,99,107],[67,97,114,103,111,46,116,111,109,108],[97,112,112],[97,112,112,46,112,121],[98,97,115,101,108,105,110,101,46,106,115,111,110],[99,111,114,101],[112,121,112,114,111,106,101,99,116,46,116,111,109,108],[115,112,101,99,115]],"base_oid":"0b28b17245ec04d13126a1e97d33cca155f1eef5","baseline_digest":null,"candidate_oid":"66fa44d56348ee2ca570112c0407f1830b99d732","clean":true,"members":["4d9110171961373d040645cba679c5e48479e3b0","7bdc690c52bc3a666029e95c2d4df0a1f078f75c"],"merge_group_id":"M1","object_format":"sha1","policy_digest":"f7922b9067977c89b6e0da60b463a64073e7b91aadadd718615f2dc3b768db23","repo_id":"cross-guard-repo","requirement_ids":["demo:A","demo:B"],"schema_version":"gitguard.candidate/v1alpha2","source_snapshot_digest":"110308fddca3312082b8a4427e8e61e4255c911aeb4a6f910eb73ab6d43d481a","task_id":"joint-queue","worktree_id":"fixture-worktree"},"changes":{"changes":[{"new_mode":"100644","old_mode":"100644","paths":[[115,112,101,99,115,47,97,46,109,100]],"status":"M"},{"new_mode":"100644","old_mode":"100644","paths":[[115,112,101,99,115,47,98,46,109,100]],"status":"M"}],"missing_coverage":[],"violations":[]},"mappingVersion":"gitguard.mapping/v1alpha1"}